,,F6790,WSA,PA,,GPC Purchases," Required to sustain day-to-day operations, providing support and services to commanders and Airmen serving in the 2 BW, 307 BW,  8 AF, and HQ AFGSC organizations  at Barksdale AFB --. These supplies include, but are not limited to: CD ROMs, DVD ROMs, paper, pens, notebooks, ink, toner, photo paper and ink,  staples and paperclips, etc. Per the Wing's PA Employment Prioritization Plan, printing services are offered for specific official requests. Costs associated with these services are borne by the 2 BW/PA budget, not by the customer. Impact if not funded: Satisfying customer requirements will be drastically impeded. To maintain current levels of service, alternate courses of action would include tracking costs and billing individual units for services performed. This is a highly inefficient use of the limited manpower in the PA shop. Mitigation: Rely on UFR process and curtail services  IAW the PA Employment and Prioritization Plan.",If not funded 2 BW/PA will not be prepared to keep an adequate supply of sundry items that enable the day-to-day mission.,,18534F,01,011Z,,61950,2603312,,304294,387700,"14,000",,,,,,,,GPC,,,,,,,,
,,F6790,WSA,PA,,Operational TDYs & training and developmental TDYs,"As the Tier 2 production facility for AFGSC, we often need to travel to cover events, exercises, and news on behalf of Barksdale, 8 AF and, AFGSC. Additionally, our Tier 2 video team requires additional training outside of that provided by their basic skills training. Therefore, this PEC request accounts for the additional training TDYs required to provide world-class video production capability.","If not funded 2 BW/PA will be unable to take advantage of training opportunities that will increase operational effectiveness, in addition to being less capable of supporting requests from higher headquarters.",,12890F,01,011Z,,40924,2101101,,304294,387700,"15,000",,,,,,,,Travel,,,,,,,,
,,F6790,WSA,PA,,Reserve Man Days,"MPA day funding is necessary to fulfill certain surge mission requirements. Our mission requires support for MAJCOM HQ as a Tier 2 video production facility. Due to the way PA assignment and deployment taskings now work, the PA office could be down up to 50% while needing to accomplish MAJCOM/CC directed missions. Therefore, this man-day per diem funding will help to cover those mission shortfalls.",If not funded 2 BW/PA will forfeit an option to bolster staff capability during periods of increased ops tempo and/or periods of reduced active-duty manning.,,12890F,01,011Z,,40924,2101101,,304294,387700,"10,000",,,,,,,,Travel,,,,,,,,
,,F6790,WSA,Retiree ,,Copier rental and maintenance (moved from CPTS to retiree),Copier rental and maintenance ,If not funded it will stop advertisment and communication shared with retiree members,,18534F,,011Z,,50301,2401101,,300102,387700,"1,500",,,,,,,,MIPR,,,,,,,,
,,F6790,WSA,Retiree ,,GPC Purchases,Retiree newsletter ,Limit information shared with base prsnl,,18534F,,011Z,,61950,2603312,,300102,387700,"9,000",,,,,,,,GPC,,,,,,,,
,,F6790,WSA,SAPR,,GPC Purchases,"SAPR Gear, office supplies, outreach events  ",NAF/MAJCOM and Wing will not have adequate materials to educate and implement various outreach activities to bring more awareness to sexual assault and prevention for all active duty and civilian personnel assigned to the Barksdale AFB and it’s tenant units.,,88738F,,042G,,61950,2603312,,3001U0,387700,"40,000",,,,,,,,GPC,,,,,,,,
,,F6790,WSA,SAPR,,Mandated operational training TDYs,HAF directed TDY costs ,"Without ability to TDY to events, SARC/VA may not be certified to fulfill their duties, nor be able to maintain certification as 36 CEUs are required every (2) years.  Additionally, as some of our tenant units are geographically separated, short TDYs may be required to support their training requirements.",,88738F,,042G,,40924,2101101,,3001U0,387700,"8,000",,,,,,,,Travel,,,,,,,,
,,F6790,WSA,SE,,Motorcycle Safety Course,"Funding for motorcycle training courses for approximately 250 to 400 Barksdale personnel to attend 3 separate training courses on motorcycle operation and safety; the Basic Rider Course, the Advanced Rider Course and the Rider Refresher Course.",Not funding could potencially increase motorcycle accidents among Wg prsnl.,,18534F,,011Z,,559ZZ,252220Z,2X,3001D0,387700,"20,000",,,,,,,,,,,,,,,,
,,F6790,WSA,SE,,Training courses,"Flight Profiency training(7000), Barksdale OSHA Training courses(36,000)",,,18534F,,011Z,,61950,2603312,,3001D0,387700,"43,000",,,,,,,,GPC,,,,,,,,
,,F6790,WSA,SE,,Tech Refresh,Productivity and efficiency of the computers have diminished due to the life cycle of the computers. Will provide more effective workflow.,Productivity and efficiency will continue to diminish which will result increased cost for serviceability and operational costs,,18534F,,011Z,,61950,2603312,,3001D0,387700,"23,000",,,,,,,,GPC,,,,,,,,
,,F6790,WSA,SE,,Unit Vehicle fuel,Fuel for 3 trucks in support of the Safety Offices's mission requirements.,If not funded safety prsnl will not be able to perform runway safety thus stopping the wing msn,,18534F,,011Z,,641,2601301,,3001D0,387700,"1,900",,,,,,,,Fuel,,,,,,,,
,,F6790,WSA,SE,,Office supplies and equipment,"AFI 91-202, para 2.4.2.4. Safety staff require special purpose clothing and PPE (safety toe boots and hearing protection) to perform mission requirements & AFI 91-203, para 14.4.10-- Safety Shoes, Toe Caps, Leggings, etc. Protective footwear shall be provided and worn when there is a reasonable possibility of foot injuries from heavy or sharp objects and electrical and/or static electricity. & AFMAN 91-203, para 14.4.6. Hearing Protection. Exposure to high noise levels can cause hearing loss or impairment, in addition to physical and psychological stress. Specifically designed protection may be required, depending on the type of noise encountered and the auditory condition of the employee. Safety staff consists of 10 active duty personnel who require non-slip safety toe shoes, hearing protection and cold weather gear. This equipment will allow personnel to enter hazardous areas and be exposed to harsh climates when conducting risk assessments, facility inspections and mishap investigations. Pricing based on $200 steel toe boots, $300 professional firearms hearing protection and $300 cold weather gear.","Not funding this requirenment will limit the PPE used by safety prsnl.  Additionally, it will put a stop to office admin operations.",,18534F,,011Z,,61950,2603312,,3001D0,387700,"14,840",,,,,,,,GPC,,,,,,,,
,,F6790,WSA,SE,,Mandated operational training TDYs,"Occupational Safety Mandatory TDYs( 6600) , Chief of Safety Mandatory TDYs(1,767), Flight Safety Mandatory TDYs(5500) , Occupational Safety Manager Mandatory TDYs( 2700 ), Weapon Safety Profiency Training TDYs(13,800), Occupational Safety Profiency Training TDYs(12000)","Mandated trng, will stop safety msn.",,18534F,,011Z,,40924,2101101,,3001D0,387700,"42,367",,,,,,,,Travel,,,,,,,,
,,F6790,WSA,XP,,Copier rental and maintenance,"Funding for the annual lease, with service maintenance, of a multi-purpose copier, printer and fax machine to help accomplish mission requirements.",,,11113F,,011A,,50301,2401101,,300300,387700,"2,088",,,,,,,,MIPR,,,,,,,,
,,F6790,WSA,XP,,GPC Purchases,"Office supplies and equipment ($1050), Xerox toner (ink) cartridges XP ($594), Lexmark toner (ink) cartridges CAT ($1,528), Lexmark toner (ink) cartridges alt CAT ($1528), Copier paper for 3 offices($820)",Not funded will limit or stop daily ops ,,11113F,,011A,,61950,2603312,,300300,387700,"5,520",,,,,,,,GPC,,,,,,,,
,,F6790,WSA,XP,,Operational training and developmental TDYs,HAF directed TDY costs ,If not funded it will make XP prsnl  unable to operate ,,11113F,,011A,,40924,2101101,,300300,387700,"3,000",,,,,,,,Travel,,,,,,,,
,,F6790,Maintenance Group,2 MXS,,PPE,"Personnel Protective Equipment purchases include safety toe boots, coveralls, work gloves, hearing protection, reflective belts, safety glasses, and camelbacks for 650 personnel. Personnel are mandated to wear proper PPE items when performing primary duties (AFI 21-101, OSHA 1910.95, OSHA 1910.136, and Occupational Safety and Health Act of 1970).  Safety toe boots, work gloves and coveralls carry the highest wear-out rate and tend to get issued multiple times to an individual.  Cold/wet weather gear is required for BAFB flight line operations and B-52 missions worldwide.  Cold/wet weather gear such as fleece and APECS items are issued to personnel.  The mandatory wear date for the OCP uniform is April 2021, requiring an additional 100% issue of OCP wet weather gear.","Personnel will be affected by weather leading to sickness.  Additionally exposure to loud noise and industrial area hazards can lead to physical injuries or death.  On average, Barksdale receives rain 127/365 days a year and temperatures during the months Dec through Mar range 38 - 59 degrees Fahrenheit.  Without rain gear/cold weather gear, Barksdale would be unable to launch or work on aircraft during these times.",2,11113F,,011A,E,61956,2603327,,34FIJ0,387700,"118,000.00",,"118,000.00",,,,"118,000.00",,GPC,Yes,,No,,,,2nd Bomb Wing (ALO),
,,F6790,Maintenance Group,2 MUNS,,PPE,"Personnel Protective Equipment includes safety toe boots, coveralls, work gloves, hearing protection. reflective belts, safety glasses, face shields, camelbacks, and lanyards. Personnel are mandated to wear proper PPE items when performing primary duties (AFI 21-101, OSHA 1910.95, OSHA 1910.136, and Occupational Safety and Health Act of 1970). Some items are one-time issued, however other items have wear-out rates that vary between 3-12 months. Safety toe boots, work gloves and coveralls carry the highest wear-out rate and tend to get issued multiple times to an individual while assigned to 2nd MUNS. Standard cost to outfit one individual initially is $400. Average annual cost per individual for sustainment of PPE is $300 (250 personnel)","Personnel will be affected by weather leading to sickness.  Additionally exposure to loud noise and industrial area hazards can lead to physical injuries or death.  On average, Barksdale receives rain 127/365 days a year and temperatures during the months Dec through Mar range 38 - 59 degrees Fahrenheit.  Without rain gear/cold weather gear, Barksdale would be unable to launch or work on aircraft during these times.",2,11113F,,011A,E,61956,2603327,,34FIE9,387700,"50,000.00",,"50,000.00",,,,"50,000.00",,GPC,Yes,,No,,,,2nd Bomb Wing (ALO),
,,F6790,Maintenance Group,2 AMXS,,PPE,"Personnel Protective Equipment purchases include safety toe boots, coveralls, work gloves, hearing protection, reflective belts, safety glasses, and camelbacks for 735 personnel. Personnel are mandated to wear proper PPE items when performing primary duties (AFI 21-101, OSHA 1910.95, OSHA 1910.136, and Occupational Safety and Health Act of 1970).  Safety toe boots, work gloves and coveralls carry the highest wear-out rate and tend to get issued multiple times to an individual.  Cold/wet weather gear is required for BAFB flight line operations and B-52 missions worldwide.  Cold/wet weather gear such as fleece and APECS items are issued to personnel.  The mandatory wear date for the OCP uniform is April 2021, requiring an additional 100% issue of OCP wet weather gear.","Personnel will be affected by weather leading to sickness.  Additionally exposure to loud noise and industrial area hazards can lead to physical injuries or death.  On average, Barksdale receives rain 127/365 days a year and temperatures during the months Dec through Mar range 38 - 59 degrees Fahrenheit.  Without rain gear/cold weather gear, Barksdale would be unable to launch or work on aircraft during inclement weather and 2d Bomb Wing would be unable to maintain its fully mission capable levels for the B-52.",2,11113F,,011A,E,61956,2603327,,34FIG0,387700,"185,000.00",,"185,000.00",,,,"185,000.00",,GPC,Yes,,No,,,,2nd Bomb Wing (ALO),
,,F6790,Operations Group,OCO,,Deployment Gear,Deploy Gear for entire 2 BW with the exception of 2 MSG,Not fund the OCO gear would halt all Deployments to Centcom area and put Strain on allied forces,A,018534F,,011D,K,61950,2603312,,3303G0,387700,"300,000.00",,,,,,,,,,,No,,,,2nd Bomb Wing (ALO),
,,F6790,Operations Group,Fly,,Flying Hour PPE,"Purchase of consumables made either by GPC/Form 9 that are directly related to aircraft maintenance.  This covers items such as Personal Protective Equipment for flying related duties such helmets, masks, headsets, anti exposure suits, and flyer gloves as required by AFI 11-301 Vol 1 Para 2.17 for flying crew to fly, failure to fund will result in severe loss of aircrew training and degradation of ability to perform assigned tasking, gear to protect individuals from harsh winter conditions.","We will not be equipped to perform daily maintenance or modernize our equipment/procedures.  We will lose the ability to repair support equipment, directly affecting the flying hour program and the mission of AFGSC.",A,11113F,,011D,K,61952,2603313,,33FI42,387700,"400,000.00",,,,,,,,,,,No,,,,2nd Bomb Wing (ALO),
,,F6790,Operations Group,Fly,,Freshette,Purchase of Freshette made either by GPC are related for female flight crew.  Failure to fund will result in severe loss of female aircrew training and degradation of ability to perform assigned tasking.,Due to design of our aircraft freshettes are required for all female flyers.  Due to bio hazard issues they ave to be issued individuals.  ,A,11113F,,011D,K,61952,2603313,,33FI42,387700,"10,000.00",,,,,,,,,,,No,,,,2nd Bomb Wing (ALO),
,,F6790,Operations Group,Fly,,Seat Chusions,Purchase of Gel Seat chushions for entire fleet last purchased 2001.  ,We will not be equipped with servicable seat cushions to perform daily lights and we are hurting our flyers by giving them substandard equipment for long mission incurring more back/spine issues.,A,11113F,,011D,K,61952,2603313,,33FI42,387700,"257,400.00",,,,,,,,,,,No,,,,2nd Bomb Wing (ALO),
,,F6790,Operations Group,Fly,,AFE Tools/Equipment,"Purchase of tools made either by GPC/Form 9 that are directly related to aircraft maintenance.  This covers items such as tools and support equipment for continued B-52 repair, due to mission related duties.  Failure to fund will result in severe loss of aircrew training and degradation of ability to perform assigned tasking.","We will not be equipped to perform daily maintenance or modernize our equipment/procedures.  We will lose the ability to repair aircraft, directly affecting the flying hour program and the mission of AFGSC.",A,11113F,,011D,K,61952,2603313,,33FI42,387700,"60,000.00",,,,,,,,,,,No,,,,2nd Bomb Wing (ALO),
,,F6790,Operations Group,Fly,,Bose Headsets,Purchase of Bose Headsets  made either by GPC/Form 9 that are directly related to aircraft missions.  This covers all flyers attatched to 2 BW for flying duties.  The BOSE noise canx headsets make flying in this aircraft safer due to the ability to hear radio calls and better communication.,Not funding would subject all flyers to a higher noise and confusion level in aircraft.  Headsets are half the weight of current headsets and have better noise quality.,A,11113F,,011D,K,61952,2603313,,33FI42,387700,"175,000.00",,,,,,,,,,,No,,,,2nd Bomb Wing (ALO),
,,F6790,Operations Group,FTU,,PPE,"FTU Gov't Purchase Card purchases for required, initial issue Personnel Protective Equipment,   Purchase of flyers safety gear for day-to-day operations. Flight suits, Cold weather layering system, flight approved boots, ewo locks, whiz wheel, time speed dividers, plotters, stop watch and other misc gear for assigned active flyers.  Combat capability would suffer due to individuals not having serviceable items necessary for flight. Cost for Student Flyer is $3210, Permanent flyer $1,956, Enlisted initial $650 and Enlisted recurring $250 cost.  Items include all items associated with day to day flying operations. Not Covered under Flying Hour Cost. 140 student flyers, 65 Permanent Flyers and 12 enlisted assigned .","If not funded, it would be forced to reduce the necessary PPE for flyers, potentially forcing them into unsafe conditions while flying or during an emergency.  Combat capability would suffer due to individuals not having serviceable items necessary for flight.
",1,27597F,,011D,K,61950,2603312,,33FI04,387700,"581,000.00",,,,,,,,,,,No,,,,2nd Bomb Wing (ALO),
,,F6790,Operations Group,FTU,,CONSUMABLES/SUSTAINMENT,"FTU Consisit of 220 Individuals, Gov't Purchase Card purchases for required consumable items/equipment, calibration/repair/replacement of non-fly equipment, weight testing, Mule/repair maintenance and mission critical/sensitive support items not categorized as flying hour authorized/approved. Requirement include cleaning  supplies for facilities not covered on the base cleaning contract due to the fact they are located in a secure area and cannot be added to the contract.","If not funded, it would be forced to reduce the necessary. Lack of funding would result in failure of facility , and support equipment and mission capabilties. Employees will be unable to perform their assigned duties causing mission failure do to not having proper/ Quainty of items.",2,27597F,,011D,K,61950,2603312,,33FI04,387700,"45,000.00",,,,,,,,,,,No,,,,2nd Bomb Wing (ALO),
,,F6790,Operations Group,ATCALS,,Equipment,"All equipment is required for daily aircraft interaction / exercises.  As equipment gets older and doesn’t get replaced it hinders the mission. Base Station Radio (AMOPS), three Extension panels for VOIP phone  hotlines, Lightgun, two PIR (ILS Test Equipment), two Range Finders, two Sunnto Tandem DG Clinometer,  Vehicle mounted Radio, Vehicle mounted UHF radio,  two Vehicle Tablet Mount Kit.",There is no work around for proper operating equipment.  As equipment gets degraded work production goes down and it affects all sorties. By not having up to date equipment the mission suffers due to time lags.,1,35114F,,012A,J,61950,2603312,,3311M0,387700,"159,100.00",,,,,,,,,,,No,,,,2nd Bomb Wing (ALO),
,,F6790,Operations Group,ATCALS,,PPE,"ATCALS, Gov't Purchase Card purchases for required, initial issue Personnel Protective Equipment,   Purchase of safety gear for day-to-day operations. Cold weather, approved safety boots, climbing gear and other misc gear for assigned for ATCALS duties. Combat capability would suffer due to individuals not having serviceable items necessary for upkeep of airfield flight. Cost for Permanent Officer to receive necessary serviceable items is $250.  Enlisted cost to receive items are $650 per inital enlisted and $250 recuring Items include all items associated with day to day flying operations. Not Covered under Flying Hour Cost.   2 Officers and 45 enlisted assigned","If not funded, it would be forced to reduce the necessary PPE for individuals, potentially forcing them into unsafe conditions while Performing airfield Maintenance.  Combat capability would suffer due to individuals not having serviceable items necessary for duties.
",1,35114F,,012A,J,61950,2603312,,3311M0,387700,"29,800.00",,,,,,,,,,,No,,,,2nd Bomb Wing (ALO),
,,F6790,Operations Group,ATCALS,,Furniture,"ATCALS furniture was purchased at random dates, and due to the chips in the furniture coupled with broken drawers and worn spots in the finish of the desks, requires replacement because it does not represent a positive image of the ATCALS individuals assigned to this office.  Furniture to be replaced as required for unserviceable pieces.","Without funding, visitors to AtCALS may lose confidence in the professionalism of the Squadron, and 2 OG overall",E,35114F,,012A,J,61950,2603312,,3311M0,387700,"10,500.00",,,,,,,,,,,No,,,,2nd Bomb Wing (ALO),
,,F6790,Operations Group,Weather,,Weather Must Pay Computer Subscriptions,"Weather provides forecasting abilities to entire base, weater tap and faa tracker is required for daily interaction  with all mission and daily weahter information.","If not funded, we would would not be able toreceive uptodate weather info and where aircraft is located to assit in all flying aspects",0,35111F,,012A,I,61950,2603312,,331000,387700,688.00,,,,,,,,,,,No,,,,2nd Bomb Wing (ALO),
,,F6790,Operations Group,Weather,,Equipment," All equipment is required for daily aircraft interaction / exercises.  Military Grade Laser Range Finder, Kestrels - Portable Weather Sensor, three Manual Observing Kits.",There is no work around for proper operating equipment.  As equipment gets degraded work production goes down and it affects all sorties. By not having up to date equipment the mission suffers due to time lags.,1,35111F,,012A,I,61950,2603312,,331000,387700,"29,900.00",,,,,,,,,,,No,,,,2nd Bomb Wing (ALO),
,,F6790,Operations Group,Weather,,PPE,"Weather, Gov't Purchase Card purchases for required, initial issue Personnel Protective Equipment,   Purchase of safety gear for day-to-day operations. Cold weather, approved safety boots and other misc gear for assigned for Weather duties. Combat capability would suffer due to individuals not having serviceable items necessary for upkeep of airfield flight. Cost for Permanent Officer to receive necessary serviceable items is $250.  Enlisted cost to receive items are $650 per inital enlisted and $250 recuring Items include all items associated with day to day flying operations. Not Covered under Flying Hour Cost.   1 Officer and 31 enlisted assigned","If not funded, it would be forced to reduce the necessary PPE for individuals, potentially forcing them into unsafe conditions while Performing their duties.  Combat capability would suffer due to individuals not having serviceable items necessary for duties.
",2,35111F,,012A,I,61950,2603312,,331000,387700,"10,400.00",,,,,,,,,,,No,,,,2nd Bomb Wing (ALO),
,,F6790,Operations Group,Weather,,Computer/Office Peripherals,Weather Gov't Purchase Card purchases for IT/ Office Peripherals are required for life cycle swap and updating of broken items.,"If not funded, it would be forced to utilze substandard equipment and degrade work effectivness to to unsatifactory standards.",2,35111F,,012A,I,61950,2603312,,331000,387700,"7,300.00",,,,,,,,,,,No,,,,2nd Bomb Wing (ALO),
,,F6790,Operations Group,Weather,,Furniture,"Weather furniture was purchased at random dates, and due to the chips in the furniture coupled with broken drawers and worn spots in the finish of the desks, requires replacement because it does not represent a positive image of the Weather individuals assigned to this office.  Furniture to be replaced as required for unserviceable pieces.","Without funding, visitors to WEATHER may lose confidence in the professionalism of the Squadron, and 2 OG overall",E,35111F,,012A,I,61950,2603312,,331000,387700,"3,200.00",,,,,,,,,,,No,,,,2nd Bomb Wing (ALO),
,,F6790,Operations Group,96th,,PPE,"96th BS, Gov't Purchase Card purchases for required, initial issue Personnel Protective Equipment,   Purchase of flyers safety gear for day-to-day operations. Flight suits, Cold weather layering system, flight approved boots, ewo locks, whiz wheel, time speed dividers, plotters, stop watch and other misc gear for assigned active flyers. Combat capability would suffer due to individuals not having serviceable items necessary for flight. Cost for Permanent flyer to receive necessary serviceable items is $1,956.  Enlisted cost to receive items are $650 per inital enlisted and $250 recuring Items include all items associated with day to day flying operations. Not Covered under Flying Hour Cost.  100 Flyers and 27 enlisted assigned","If not funded, it would be forced to reduce the necessary PPE for flyers, potentially forcing them into unsafe conditions while flying or during an emergency.  Combat capability would suffer due to individuals not having serviceable items necessary for flight.
",1,11113F,,011A,E,61950,2603312,,,387700,"75,000.00",,,,,,,,,,,No,,,,2nd Bomb Wing (ALO),
,,F6790,Operations Group,20th,,PPE,"20th BS, Gov't Purchase Card purchases for required, initial issue Personnel Protective Equipment,   Purchase of flyers safety gear for day-to-day operations. Flight suits, Cold weather layering system, flight approved boots, ewo locks, whiz wheel, time speed dividers, plotters, stop watch and other misc gear for assigned active flyers. Combat capability would suffer due to individuals not having serviceable items necessary for flight. Cost for Permanent flyer to receive necessary serviceable items is $1,956.  Enlisted cost to receive items are $650 per inital enlisted and $250 recuring Items include all items associated with day to day flying operations. Not Covered under Flying Hour Cost.  100 Flyers and 27 enlisted assigned","If not funded, it would be forced to reduce the necessary PPE for flyers, potentially forcing them into unsafe conditions while flying or during an emergency.  Combat capability would suffer due to individuals not having serviceable items necessary for flight.
",1,11113F,,011A,E,61950,2603312,,,387700,"75,000.00",,,,,,,,,,,No,,,,2nd Bomb Wing (ALO),
