Requirement Number,Status,Operating Entity,Group,Unit/ Directorate,Owner Ranking,Title,Justification,Impact if not Funded,"Priority Level (0, 1, 2, A, E)",PEC,BA,SAG,Panel,EEIC,Object Class,ESP,Cost Center,AAI , Requirement Total , Wing Funded Total  , Unfunded Total based on Wing Funded ,PEM Remarks,HQ FMA Remarks, EP Funded Amount , Unfunded Amount Based on EP Funding , Need By Date ,Method of Purchase,Is Recurring,Final FY,Is Civ Pay,Contract Number ,PoP Start Date,PoP End Date,Created By Org,AFGSC/FMAO Reveiwed By
2022-F6790-000001,In Work,F6790,Operations Group,FTU,,GPC CONSUMABLES,"11 BS FTU Consist of 220 Individuals, Gov't Purchase Card purchases for required consumable items/equipment, calibration/repair/replacement of non-fly equipment, weight testing, Mule/repair maintenance and mission critical/sensitive support items not categorized as flying hour authorized/approved. Requirement include cleaning  supplies for facilities not covered on the base cleaning contract due to the fact they are located in a secure area and cannot be added to the contract.","If not funded, it would be forced to reduce the necessary. Lack of funding would result in failure of facility , and support equipment and mission capabilties. Employees will be unable to perform their assigned duties causing mission failure do to not having proper/ Quainty of items.",2,27597F,,011D,K,61950,2603312,,33FI04,387700,"45,000.00",,,,,,,,,,,No,,,,2nd Bomb Wing (ALO),
2022-F6790-000002,In Work,F6790,Basewide,Basewide,,Civilian Pay OCO,Civilian Pay NA,UMD Funded @ 97% w/1.5% inc,0,18534F,,011Z,N,111RG,11100RG,7C,300500,387700,"150,000.00",,,,,,,,,,,Yes,,,,2nd Bomb Wing (ALO),
2022-F6790-000003,In Work,F6790,Operations Group,ATCALS,,GPC CONSUMABLES,"ATCAL (Tower)  consist of 43 individuals in 3 shops airfield ops, RAWS, (Flight instrument specialist) and tower cab.   They Service Barksdale AFB and all tenants assigned. This funding is required for Gov't Purchase Card purchases for required consumable items/equipment, calibration/repair/replacement, Mule/servicing/repair maintenance/replacement,  and mission critical/sensitive support items not categorized as flying hour. This encompasses all aspects of airfield ops, tower Cab and RAWS.  Some items include airfield ops hot Spot for wireless connectivity while on the ramp.  RAWs multiple speciality tools required for duties.  Tower Cab multiple  ground service items to include ear pieces/ head sets. (WHAT IS RAWS) Regulartory guidance ","If not funded, it would be forced to reduce the necessary. Lack of funding would result in failure of facility , and support equipment and mission capabilties. Employees will be unable to perform their assigned duties causing mission failure do to not having proper/ Quainty of items.",2,35114F,,012A,J,61950,2603312,,3311M0,387700,"18,400.00",,,,,,,,,,,No,,,,2nd Bomb Wing (ALO),
2022-F6790-000004,In Work,F6790,Wing Staff Agencies,Violence Prevention Program,,Violence Prevention Program,"The VPI Office provides Suicide Prevention and SAPR mandatory annual training for all AD and Civ personnel assigned to Barksdale AFB, including all tenant unit personnel. As part of this annual TFAT, handouts, rosters and pens, peripheral computer equipment, as well as materials utilized during the workshop are needed for each workshop. In addition, the VPI is responsible for four awareness months throughout the year, and is expected to plan and implement various outreach and educational activities for the installation population. This requires supplies (e.g.- paper, printer ink, pens), printed materials, video recording and editing, locally printed pamphlets, resource materials, etc. The VPI is the SPPM (Suicide Prevention Program Manager) for the installation, which includes additional outreach, education & training, conference attendance and program management responsibilities. These duties, as well as other assigned duties, require professional continuing education in the subject matter as well as frequent use of common office equipment and supplies such as laptop [with dock], computer camera and audio, ergonomic mouse and keyboard, computer monitor (x2), computer cables and connectors, scanner, printer, printer ink, printer paper, pens, correction tape, staples, paper clips, thumb tacks, highlighters, binder clips, garbage bags, annual planner, CD ROM, folders, carry cases, business cards, laminating paper, and other office supplies.  Educational Training for estimated 20 people to facilitate SafeTALK/True Colors programs.",Wing will not have adequate materials and trained facilitators to educate and implement various outreach activities to bring more awareness to suicide prevention for all active duty and civilian personnel assigned to the Wing.,2,88737F,,042G,P,61950,2603312,,3001U4,387000,"37,300.00",,,,,,,,,,,No,,,,2nd Bomb Wing (ALO),
2022-F6790-000005,In Work,F6790,Operations Group,Weather,,Mission TDY,"Weather Squadron consist of 18 individuals, For individuals going TDY and formal training schools and conferences not paid for by AETC . ","Without funding, will be unable to keep manning requirements for current qualified individuals up to date on various matters that occurs in regards to the mission. Mission TDYs required for flight crews, A/C sortie generation, aircraft Divert, 2BW supported Airshows, Weapons System Reviews and specialist mandated training (not AETC funded).",2,35111F,,012A,I,40924,2101101,,331000,387700,"10,000.00",,,,,,,,,,,No,,,,2nd Bomb Wing (ALO),
2022-F6790-000006,In Work,F6790,Operations Group,Weather,,GPC CONSUMABLES,"Weather Squadron consist of 32 individuals they Service,  2d OG (3 Squadrons) Gov't Purchase Card purchases for required consumable items/equipment, calibration/repair/replacement of non-fly equipment, weight testing, and mission critical/sensitive support items not categorized as flying hour authorized/approved.","If not funded, it would be forced to reduce the necessary. Lack of funding would result in failure of facility , and support equipment.  ",2,35111F,,012A,I,61950,2603312,,331000,387700,"12,000.00",,,,,,,,,,,No,,,,2nd Bomb Wing (ALO),
2022-F6790-000007,In Work,F6790,Operations Group,2 OG,,TDY RESERVE MANDAYS,Funds needed to support Reserve Manpower Days during High Ops Tempo and Large Scale Exercises and critically short shops TDY FUNDS ONLY,Reservists would not be able to use the authorized man-days because no funds are available for the travel and per diem for them to come from outside local area,2,11113F,,011A,E,40945,2101106,,331000,387700,"130,000.00",,,,,,,,,,,No,,,,2nd Bomb Wing (ALO),
2022-F6790-000008,In Work,F6790,Operations Group,2 OG,,GPC CONSUMABLES,"2d OG Gov't Purchase Card purchases for required consumable items/equipment, calibration/repair/replacement of non-fly equipment, weight testing, Mule/repair maintenance and mission critical/sensitive support items not categorized as flying hour authorized/approved. ","If not funded, it would be forced to reduce the necessary. Lack of funding would result in failure of facility , and support equipment and mission capabilties. Employees will be unable to perform their assigned duties causing mission failure do to not having proper/ Quainty of items.",1,11113F,,011A,E,61950,2603312,,331000,387700,"30,000.00",,,,,,,,,,,No,,,,2nd Bomb Wing (ALO),
2022-F6790-000009,In Work,F6790,Operations Group,2 OG,,FUEL VEHICLE ,Ground fuel used for vehicles to support day-to-day flightline operations For entire OG to include all 4 Squadrons. Prior to aircraft launch an individual has to drive around the aircraft to ensure all panels and doors are secure. After each aircraft launch airfield.  operations has to perform a runway sweep to ensure no obstructions is on the runway.  weekdays have a minimum of 6 flights per day .  If aircaraft has issue prior to take off vehicles are used to  transport maintenance and parts to aircraft.  ,Lack of funding would inhibit the launching and recovery of all aircraft from barksdale AFB.  If individuals had to walk to aircraft ramp it would severly increase the time to get to aircraft and fix resulting in missing mission requirments increase flight time and reducing combat capabilty by not having crew members current on training,1,11113F,,011A,E,641,2601301,,331000,387700,"6,000.00",,,,,,,,,,,No,,,,2nd Bomb Wing (ALO),
2022-F6790-000010,In Work,F6790,Maintenance Group,2 AMXS,,Mission TDY,Mission TDYs required for flying crew chief chamber training and Aircraft sortie generation/recovery,"Failure to recover aircraft from locations other than BAFB will degrade the mission.  Also, specific training not conducted at BAFB is required for our crew chiefs required to fly with aircrew personnel on missions, without funding, 2 AMXS would be unable to replace currently certified crew chiefs when they PCS.",1,11113F,,011A,E,40924,2101101,,34FIG0,387700,"22,000.00",,"22,000.00",,,,"22,000.00",,DTS,Yes,,No,,,,2nd Bomb Wing (ALO),
2022-F6790-000011,In Work,F6790,Maintenance Group,2 MXS,,Mission TDY,"Support required for Aircraft system review conferences/symposiums, and unit funded conferences",Failure to fund will result in maintenance personnel not being able to attend conferences in person to learn new innovative processes and equipment available to maintain the B-52 and support equipment.  Maintenance Squadron supervision would not have input at symposiums where decisions concerning the B-52 and support equipment are decided.,2,11113F,,011A,E,40924,2101101,,34FIJ0,387700,"10,000.00",,"10,000.00",,,,"10,000.00",,DTS,Yes,,No,,,,2nd Bomb Wing (ALO),
2022-F6790-000012,In Work,F6790,Maintenance Group,2 MXS,,Consumables,"Provides operating materials supporting 650 personnel.  Items include toner, paper, general office supplies, restroom supplies, cleaning supplies, light bulbs and other daily use items.  Funds also provide for replacement of minor office equipment such as shredders.  Paper and toner are critical in the maintenance of aircraft to allow for the production of aircraft forms and other documents without which aircraft would be prohibited from flight.",This can impact health and safety if cleaning/hygienic supplies are unavailable.  Failure to replace office supplies and equipment severely hinders the ability to complete daily tasks and ensure a positive flow of communication.,2,11113F,,011A,E,61950,2603312,,34FIJ0,387700,"50,000.00",,"50,000.00",,,,"50,000.00",,GPC,Yes,,No,,,,2nd Bomb Wing (ALO),
2022-F6790-000013,In Work,F6790,Maintenance Group,2 MXG,,RESERVE MANDAYS/TDYS,Funds needed to support Reserve Manpower Days doing High Ops Tempo and Large Scale Exercises,Reservists would not be able to use the authorized man-days because no funds are available for the travel and per diem for them to come from outside local area,2,11113F,,011A,E,40945,2101106,,342600,387700,"15,000.00",,"15,000.00",,,,"15,000.00",,DTS,Yes,,No,,,,2nd Bomb Wing (ALO),
2022-F6790-000014,In Work,F6790,Maintenance Group,2 MXG,,MISSION TDYS,"Support required for Weapons system reviews, group commander tdys, graduation attendance, and unit funded conferences","Failure to fund will result in group personnel not being able to attend conferences in person to learn new innovative processes and equipment available to maintain the B-52, support equipment, and munitions.  2 MXG would not have a ""voice"" at symposiums where decisions concerning the B-52, support equipment, and munitions are accomplished.",,11113F,,011A,E,40924,2101101,,342600,387700,"40,000.00",,,,,,,,,,,No,,,,2nd Bomb Wing (ALO),
2022-F6790-000015,In Work,F6790,Maintenance Group,2 MXG,,CONSUMABLES,"2d MXG (3 Squadrons, 4 Flights and staff/1850 personnel) Gov't Purchase Card purchases for required consumable items/equipment, calibration/repair/replacement of non-fly equipment, weight testing, Mule/compressor servicing/repair maintenance/replacement,  and mission critical/sensitive support items not categorized as flying hour authorized/approved. Replace air compressors at two back-shop facilities(not real property), air testing components and filtration system of the paint booth and flight-line support equipment.  Requirement include cleaning and restroom supplies for facilities not covered on the base cleaning contract due to the fact they are located in a secure areas and cannot be added to the contract.","Lack of funding would result in failure of compressors, facility air, and support equipment.  Unable to purchase replacement tools/equipment when they break.  Lack of funding will also cause facilities to be unsanitary creating a breeding ground for disease, and eventually illness to employees who will be unable to perform their assigned duties causing mission failure.",1,11113F,,011A,E,61950,2603312,,342600,387700,"300,000.00",,"300,000.00",,,,"300,000.00",,GPC,Yes,,No,,,,2nd Bomb Wing (ALO),
2022-F6790-000016,In Work,F6790,Maintenance Group,2 MXG,,TRANSIENT ALERT,Contract # FA460816C0002 Monthly services and 600 extended hours.  Contract supports landing/takeoffs for all aircraft transient to BAFB.,Contract # FA460816C0002 Monthly services and 600 extended hours.  Contract supports landing/takeoffs for all aircraft transient to BAFB.,0,11113F,,011A,E,5561A,2572123,,342600,387700,"450,000.00",,"450,000.00",,,,"450,000.00",,Form 9,Yes,,No,FA460816C0002,1-Dec-21,30-Nov-22,2nd Bomb Wing (ALO),
2022-F6790-000017,In Work,F6790,Maintenance Group,2 MXG,,LEASED COPIERS,10 leased high-volume DLA copiers throughout 2 MXG. Savings just on ink cartridges/maintenance is over 60k annually,Unable to print CDCs for members in AFSCs that have a CDC program,2,11113F,,011A,E,50301,2401101,,342600,387700,"32,000.00",,"32,000.00",,,,"32,000.00",,MIPR,Yes,,No,,,,2nd Bomb Wing (ALO),
2022-F6790-000018,In Work,F6790,Maintenance Group,2 MUNS,,CALCM XB-3 Supply Consumables,The needed funding necessary to complete AFGSC/A4W defuel/demilitarization efforts on the CALCM fleet that is maintained at BAFB. ,"Without will not be able to complete AFGSC/AFW mission requirements.  In addition, AFGSC/A4W cannibalization/reclamation of vital CALCM components to fuel Minot AFB's and Barksdale AFB's ALCM FMC stockpile would cease and cost savings generated would not be realized.",2,27323F,,011A,T,609,2602306,,34A250,667100,"100,000.00",,"100,000.00",,,,"100,000.00",,SUPPLY,Yes,,No,,,,2nd Bomb Wing (ALO),
2022-F6790-000019,In Work,F6790,Maintenance Group,2 MUNS,,ALCM XB-3 Supply Consumables,The needed funding necessary to sustain the ALCM return to service mission that is vital for USSTRATCOM directed testing and AFGSC directed rebasing of missiles.,The needed funding necessary to sustain the ALCM return to service mission that is vital for USSTRATCOM directed testing and AFGSC directed rebasing of missiles.,1,11122F,,011A,E,609,2602306,,342760,667100,"100,000.00",,"100,000.00",,,,"100,000.00",,SUPPLY,Yes,,No,,,,2nd Bomb Wing (ALO),
2022-F6790-000020,In Work,F6790,Maintenance Group,2 MUNS,,Missile rebasing,To properly fund Missile shipments directed rebasing by AFGSC for ALCM missiles to Minot AFB.,If not funded will not be able to rebase missiles to Minot AFB as required by AFGSC.,1,11122F,,011A,E,46200,2201101,,342760,387700,"50,000.00",,"50,000.00",,,,"50,000.00",,MORD,Yes,,No,,,,2nd Bomb Wing (ALO),
2022-F6790-000021,In Work,F6790,Mission Support Group,Contracting,,GPC - Operation and Maintenance Supplies (Recurring),"Office supplies and equipment used in the acquisitioning process that support the purchase of Barksdale supplies, services and construction services.  2 CONS requires toners, paper, folders, tabs and various other organizational tools.",Work stoppage - 2 CONS personnel won't be able to perform their daily duties.,2,18534F,,011Z,N,61950,2603312,,3A4A00,387700,"12,000.00",,,,,,,,,,,No,,,,2nd Bomb Wing (ALO),
2022-F6790-000022,In Work,F6790,Mission Support Group,Contracting,,TDY - CONS ,"TDY 1) Will be for Small Business Specialist to attend Annual Small Business Administration conference/training/workshop/retreat.   There are approximately 4 conferences.  Two are located  within driving range of local area requiring only one night stay. The annual training is a week long training for all contracting squadron small business specialist to attend. TDY 2) GSA Smart Pay Conference - GPC Program Manager will attend this 4 day training to gain valuable tools to effectively manage the 450 cardholders located at Barksdale, which includes cardholders for MAJCOMS and tenant units as well as the ODTA for Travel in order to learn the latest updates to the Government Travel System.  FY22 location unknown at this time.  TDY 3) World Wide Contracting Conference  - The nation's premier training event for contract management, procurement, and acquisition professionals. This will be attended by the Commander. TDY 4) Civilian Functional Training  which captures critical developmental needs of civilian employees across the Air Force. 




",Hinders professional growth and compromises mission excellence.  The lack of sufficient training will prevent 2 CONS from providing the necessary support to keep the installation modernized and ready for action to execute with precise lethality.  ,2,18534F,,011Z,N,40924,2101101,,3A4A00,387700,"19,600.00",,,,,,,,,,,No,,,,2nd Bomb Wing (ALO),
2022-F6790-000023,In Work,F6790,Mission Support Group,MSG Staff,,TDY - Group Commander ,Funds are required for travel costs for Commander's school/training and mission conferences or events critical to overall operation of Mission Support Group.,MSG/CC and Staff would not be able to attend mission conferences or events critical to overall operation of Mission Support Group.,2,18534F,,011Z,N,40924,2101101,,3A4000,387700,"15,000.00",,,,,,,,,,,No,,,,2nd Bomb Wing (ALO),
2022-F6790-000024,In Work,F6790,Mission Support Group,MSG Staff,,GPC - Group Commander Office supplies/equipment phone bills,Wireless phone charges and critical office supplies that directly support day to day operations of Mission Support Group.,MSG CC/CD/CCC cell phones would be shut off. We wouldn't be able to print and sign decs and policy letters for the group.,2,18534F,,011Z,N,61950,2603312,,3A4000,387700,"15,000.00",,,,,,,,,,,No,,,,2nd Bomb Wing (ALO),
2022-F6790-000025,In Work,F6790,Mission Support Group,2 FSS,,GPC - Military Personnel Section,"To purchase office supplies for the Military Personnel, Manpower sections. Office supplies and equipment are used in the acquisitioning process that support the purchase of Barksdale supplies, services and requires toners, paper, folders, tabs and various other organizational tools. Military Personnel Flight is instrumental in protecting confidentiality reports, classified and privileged investigative documents. MPF processes PCS assignments, performance reports, ID Card applications, Personal Reliability Program paperwork and various other personnel actions for over 5.3K base members and their dependents.","These office supplies are essential for Military Personnel Flight and if not funded, could result in customers losing base access and privileges.  MPF could fail to meet Air Force and MAJCOM suspense’s for TDY’s, Deployments, PCS’s, and potential pay discrepancies.",2,18560F,,011Z,P,61950,2603312,,3A4110,387700,"27,500.00",,,,,,,,,,,No,,,,2nd Bomb Wing (ALO),
2022-F6790-000026,In Work,F6790,Mission Support Group,2 FSS,,GPC - Airman Leadership School Program Supplies,"To purchase office, classroom and graduation supplies for the Barksdale AFB Airman Leadership School.   Multiple supplies, workbooks, classroom aids and training materials are needed to maintain day-to-day operations supporting the 2d Bomb Wing personnel.","If not funded the Airmen Leadership School Program could not effectively train 400 plus Airmen to become supervisors, or effectively implement Air University/Barnes Center Curriculum as mandated by Barnes Center Instruction 36-2301 which is the directive of AFI36-2656 Developmental Education",2,84751F,,032C,H,61950,2603312,,3A3340,387700,"26,000.00",,,,,,,,,,,No,,,,2nd Bomb Wing (ALO),
2022-F6790-000027,In Work,F6790,Mission Support Group,2 FSS,,GPC - Civilian Personnel Office Program Supplies,Funds needed to purchase office supplies for the Civilian Personnel Office. Supplies are needed to maintain day-to-day operations supporting the 2d Bomb Wing civilian personnel mission requirements.,Civilian Personnel Office handles sensitive documentation and confidential reports for all of Barksdale AFB.  Failure to fund CIV Pers. with supplies would result in inability to operate and provide Barksdale AFB populous with acceptable level of service and performance,2,18561F,,011Z,P,61950,2603312,,3A4131,387700,"5,600.00",,,,,,,,,,,No,,,,2nd Bomb Wing (ALO),
2022-F6790-000028,In Work,F6790,Mission Support Group,2 FSS,,TDY - Education Center ,"Education Center is required to send personnel to attend CCAF training, Education Professional Institute (PDI), Council of College and Military Education Symposium(CCME).  Attendance to these trainings opportunities are required by AFI 36-2649","Failure to fund these TDY's will result in Education Advisors not being current on new education opportunities and requirements, therefore impacting students and customers with education needs, Air Force standards and mission requirements.",2,84702F,,033C,P,40924,2101101,,3A4140,387700,"8,000.00",,,,,,,,,,,No,,,,2nd Bomb Wing (ALO),
2022-F6790-000029,In Work,F6790,Mission Support Group,2 FSS,,Education Center Contracts,"Ed Advisor (2 Full-time counselors)/Test Admin (1 Part-time) combined contract funding is required for the annual contract in support of Barksdale personnel to include but not limited to:  advisors, classroom monitors, test administrators, distance learning monitors, computer support, special group instruction and customer service.  Education Advisor required to assist off duty students with career counseling and Associate/Bachelor degree plans. FY22 contract amount $173,003.20  Tech Support Contract funding ensures all classroom computers are operational, troubleshoots all commercial connectively,  verifies all testing files are transmitted and loaded monthly.  Monitors all maintenance, any repairs required, and security throughout the building.  Ensures operation for computer systems during off duty education and online classes. FY22 estiamted contract amount $30K ","Failure to fund the Education Advisor/Test Admin contract would result in loss of education advice, career planning, test administrators and supervision for Barksdale AFB's Airmen.   Failure to fund the Tech Support contract would result in loss of maintenance and repair of computers and software systems.",1,84702F,,033C,P,55885,2521285,,3A4140,387700,"197,340.80",,,,,,,,,,,No,,,,2nd Bomb Wing (ALO),
2022-F6790-000030,In Work,F6790,Mission Support Group,FTAC,,GPC - First Term Airmen Center Program Supplies,"To purchase office and classroom supplies for the Barksdale AFB First Term Airman Center.  Supplies are needed to maintain day-to-day operations supporting the 2d Bomb Wing personnel.  Classroom materials, training guides and office supplies are essential to complete the First Term Airmen Course which is mandatory for all first term airmen per AFI 36-2624 Ch. 6. The program is designed to provide a structured first duty station professional development program, designed to transition Airmen from a training mindset to the mission-oriented environment. FTAC goes through 360 airmen per year and includes courses such as WG/CC and WG/CCC’s perspective on Barksdale AFB and AFGSC, resiliency training, SAPR, Article 137 Briefing by Legal, Public Affairs, Personal Financial Management, Career Assistance Advisor, Chapel, AFGSC Fundamentals, ADAPT, A&FRC, Airmanship 300, Education Office and more.",If not funded we would fail in providing our First Term Airmen the tools needed to transition from a training environment to a mission-oriented environment.  First Term Airmen Course is mandatory or all first term airmen per AFI 36-2624 Ch. 6.,2,88716F,,042A,P,61950,2603312,,3A4190,387700,"6,400.00",,,,,,,,,,,No,,,,2nd Bomb Wing (ALO),
2022-F6790-000031,In Work,F6790,Mission Support Group,Base Honor Guard,,GPC - Honor Guard Program Supplies and Equipment,"Honor Guard has a high-volume administrative load that requires the constant purchase of supplies.  Every ceremony that leaves the office requires supplies.  Each case has a ceremony package which contains a cover sheet, map (in case there is no signal where the funeral is), and a 1946 with additional info in case we can’t get a hold of the funeral director (which happens a lot).  We go through a pack of 9 volt batteries every week.  We use markers, tape, paper, paper clips, cartridges/toners, sticky notes and staples every day. Honor Guard Equipment is needed to support 23 personnel for mission requirements. Requirements include uniforms, gloves, alterations, flags, flag poles and document holders. Honor Guard has high turnover between guards member and cannot re-use uniforms, every 3 months we have at least 12 new members that require uniform items (coats, pants, shoes, badges, etc.) Historically, Honor Guard participates in 1400+ events to include military funerals, retirement ceremonies and color presentations at special events. The Honor Guard must also have cell phone coverage to function at Air Force standard levels.",Without these supplies Honor Guard would not be able to make ceremony packages which would cause confusion and the loss of valuable information needed to accomplish the mission. Without proper equipment HG would not be able to participate in in these events and do their job as guardsman.,2,18534F,,011Z,N,61950,2603312,,3A45HG,387700,"47,300.00",,,,,,,,,,,No,,,,2nd Bomb Wing (ALO),
